{"dataset_id":"sha256:39c1e1d68858fd93e4f8d630b4c81fdd48ed385a381364d6a23563743c0a28c3","evaluator_id":"lambada","formal_semantics_id":"sha256:cc98f15ac20fc3ed265cb76682ca15a936e24660a651e2b8f81638abb3265cb6","method":{"case_normalization":"NONE","dataset_field":"text","exact_match_rule":"GREEDY_TOKEN_ID_SEQUENCE_EQUALS_TARGET","log_likelihood_aggregation":"SUM_TARGET_TOKEN_LOG_PROB","multi_token_target":"SCORE_AND_GENERATE_ALL_TARGET_TOKENS","prompt_construction":"PREFIX_THROUGH_FINAL_WHITESPACE","target_extraction":"FINAL_NON_WHITESPACE_SPAN","text_normalization":"UNICODE_NFC","token_boundary_policy":"JOINED_TEXT_OFFSET_OVERLAP_TOKEN_BELONGS_TO_TARGET","tokenizer_add_special_tokens":false,"whitespace_normalization":"NONE"},"schema_version":"1.0.0","tokenizer_id":"sha256:9e556afd44213b6bd1be2b850ebbbd98f5481437a8021afaf58ee7fb1818d347","type_name":"EVALUATOR_PROFILE"}
